{
  "id": "combattraces:fire",
  "priority": 100,
  "conditions": {
    "or": [
      {
        "item_tag": "combattraces:fire_weapons"
      },
      {
        "enchantment": "minecraft:fire_aspect"
      }
    ]
  },
  "trail": "combattraces:fire",
  "impact": "combattraces:fire_overlay",
  "particle": "minecraft:small_flame",
  "color": "ff8c36"
}
